[
  {"certification":"ai-practitioner","exam_code":"AIF-C01","external_id":"AIF-001","domain":"AI and ML fundamentals","difficulty":"easy","question_type":"single_answer","question_text":"Which term describes using labeled examples to train a model to predict a known outcome?","options":[{"key":"A","text":"Supervised learning"},{"key":"B","text":"Unsupervised learning"},{"key":"C","text":"Data encryption"},{"key":"D","text":"Content delivery"}],"correct_option_keys":["A"],"explanation":"Supervised learning uses labeled input-output examples. Unsupervised learning seeks patterns without labels; encryption and content delivery are unrelated.","reference_links":[],"publication_status":"draft"},
  {"certification":"ai-practitioner","exam_code":"AIF-C01","external_id":"AIF-002","domain":"AI and ML fundamentals","difficulty":"medium","question_type":"single_answer","question_text":"A retailer wants to group customers by similar buying behavior without predefined group labels. Which learning approach fits?","options":[{"key":"A","text":"Unsupervised learning"},{"key":"B","text":"Supervised classification"},{"key":"C","text":"Manual labeling"},{"key":"D","text":"Encryption at rest"}],"correct_option_keys":["A"],"explanation":"Unsupervised learning can identify clusters in unlabeled data. Supervised classification requires labeled outcomes.","reference_links":[],"publication_status":"draft"},
  {"certification":"ai-practitioner","exam_code":"AIF-C01","external_id":"AIF-003","domain":"Generative AI fundamentals","difficulty":"easy","question_type":"single_answer","question_text":"What is a primary capability of generative AI?","options":[{"key":"A","text":"Creating new content from learned patterns"},{"key":"B","text":"Only storing files"},{"key":"C","text":"Replacing all human review"},{"key":"D","text":"Guaranteeing factual answers"}],"correct_option_keys":["A"],"explanation":"Generative AI can create content such as text or images. It does not guarantee factual output or eliminate human oversight.","reference_links":[],"publication_status":"draft"},
  {"certification":"ai-practitioner","exam_code":"AIF-C01","external_id":"AIF-004","domain":"Generative AI fundamentals","difficulty":"medium","question_type":"single_answer","question_text":"In an LLM application, what is a token?","options":[{"key":"A","text":"A unit of text processed by the model"},{"key":"B","text":"An IAM user"},{"key":"C","text":"A database backup"},{"key":"D","text":"A network route"}],"correct_option_keys":["A"],"explanation":"Tokens are units of text that language models process. They are not AWS identity, storage, or networking objects.","reference_links":[],"publication_status":"draft"},
  {"certification":"ai-practitioner","exam_code":"AIF-C01","external_id":"AIF-005","domain":"Foundation model applications","difficulty":"medium","question_type":"single_answer","question_text":"A help assistant should answer from a company policy library and cite the relevant source passages. Which pattern is most appropriate?","options":[{"key":"A","text":"Retrieval-augmented generation"},{"key":"B","text":"Deleting the policy library"},{"key":"C","text":"Training without any evaluation"},{"key":"D","text":"Using a static password"}],"correct_option_keys":["A"],"explanation":"RAG retrieves relevant material to ground model responses and support citations. The other choices do not provide grounded answers.","reference_links":[],"publication_status":"draft"},
  {"certification":"ai-practitioner","exam_code":"AIF-C01","external_id":"AIF-006","domain":"Foundation model applications","difficulty":"medium","question_type":"single_answer","question_text":"What do embeddings help represent in a semantic search application?","options":[{"key":"A","text":"Meaning-related similarity between content"},{"key":"B","text":"A fixed AWS price"},{"key":"C","text":"An IAM password"},{"key":"D","text":"A physical server serial number"}],"correct_option_keys":["A"],"explanation":"Embeddings are numeric representations that enable similarity comparisons between content. They are not credentials, prices, or hardware identifiers.","reference_links":[],"publication_status":"draft"},
  {"certification":"ai-practitioner","exam_code":"AIF-C01","external_id":"AIF-007","domain":"Responsible AI","difficulty":"medium","question_type":"single_answer","question_text":"Which activity best helps identify whether an AI system performs unfairly for a demographic group?","options":[{"key":"A","text":"Evaluate outcomes across relevant subgroups"},{"key":"B","text":"Hide model limitations"},{"key":"C","text":"Remove all user feedback"},{"key":"D","text":"Use only one test example"}],"correct_option_keys":["A"],"explanation":"Subgroup evaluation can reveal performance differences that may indicate bias. Hiding limitations and reducing evaluation weaken responsible AI practice.","reference_links":[],"publication_status":"draft"},
  {"certification":"ai-practitioner","exam_code":"AIF-C01","external_id":"AIF-008","domain":"Responsible AI","difficulty":"easy","question_type":"single_answer","question_text":"Why is explainability valuable for an AI-supported decision?","options":[{"key":"A","text":"It helps people understand and appropriately assess the output"},{"key":"B","text":"It guarantees the model is never wrong"},{"key":"C","text":"It removes privacy obligations"},{"key":"D","text":"It eliminates the need for testing"}],"correct_option_keys":["A"],"explanation":"Explainability supports informed use and oversight. It does not guarantee accuracy or remove privacy and testing obligations.","reference_links":[],"publication_status":"draft"},
  {"certification":"ai-practitioner","exam_code":"AIF-C01","external_id":"AIF-009","domain":"Security, compliance, and governance","difficulty":"medium","question_type":"single_answer","question_text":"Which practice helps restrict an AI application to only the AWS permissions it needs?","options":[{"key":"A","text":"Least-privilege IAM policies"},{"key":"B","text":"Sharing root credentials"},{"key":"C","text":"Disabling encryption"},{"key":"D","text":"Publishing secrets in prompts"}],"correct_option_keys":["A"],"explanation":"Least-privilege IAM policies limit permissions to the required actions and resources. The other choices create security risks.","reference_links":[],"publication_status":"draft"},
  {"certification":"ai-practitioner","exam_code":"AIF-C01","external_id":"AIF-010","domain":"Security, compliance, and governance","difficulty":"medium","question_type":"single_answer","question_text":"Which control best protects sensitive data sent to an AI application while it travels over a network?","options":[{"key":"A","text":"Encryption in transit"},{"key":"B","text":"Publicly sharing the data"},{"key":"C","text":"Removing access controls"},{"key":"D","text":"Using a shorter prompt"}],"correct_option_keys":["A"],"explanation":"Encryption in transit protects data while it moves across networks. Prompt length and public exposure do not provide transport protection.","reference_links":[],"publication_status":"draft"},
  {"certification":"ai-practitioner","exam_code":"AIF-C01","external_id":"AIF-011","domain":"AI and ML fundamentals","difficulty":"medium","question_type":"single_answer","question_text":"Which stage uses a trained machine learning model to generate a prediction for new input data?","options":[{"key":"A","text":"Inference"},{"key":"B","text":"Data labeling"},{"key":"C","text":"Model training"},{"key":"D","text":"Data archival"}],"correct_option_keys":["A"],"explanation":"Inference is the use of a trained model to produce predictions or outputs for new input. Training adjusts the model using learning data; labeling and archival are separate activities.","reference_links":[],"publication_status":"draft"},
  {"certification":"ai-practitioner","exam_code":"AIF-C01","external_id":"AIF-012","domain":"AI and ML fundamentals","difficulty":"medium","question_type":"single_answer","question_text":"A team trains a model using past loan applications with outcomes marked approved or denied. What kind of data are the outcome labels?","options":[{"key":"A","text":"Labeled data"},{"key":"B","text":"Unstructured encryption"},{"key":"C","text":"Inference results"},{"key":"D","text":"Vector indexes"}],"correct_option_keys":["A"],"explanation":"The known approval outcomes are labels used with the input features during supervised learning. Inference outputs occur after a model is used, and vector indexes serve different retrieval purposes.","reference_links":[],"publication_status":"draft"},
  {"certification":"ai-practitioner","exam_code":"AIF-C01","external_id":"AIF-013","domain":"Generative AI fundamentals","difficulty":"medium","question_type":"single_answer","question_text":"What is the main purpose of a prompt in a generative AI application?","options":[{"key":"A","text":"To provide instructions and context for the model response"},{"key":"B","text":"To permanently retrain the model"},{"key":"C","text":"To replace access controls"},{"key":"D","text":"To encrypt an AWS account"}],"correct_option_keys":["A"],"explanation":"A prompt supplies instructions and context that guide a model's generated response. Prompting does not permanently retrain a model or replace security controls.","reference_links":[],"publication_status":"draft"},